<?xml version="1.0" encoding="utf-8"?>
<xs:schema xmlns="http://www.uniovi.es" elementFormDefault="qualified" targetNamespace="http://www.uniovi.es" xmlns:xs="http://www.w3.org/2001/XMLSchema">
	<xs:element name="circuito">
		<xs:complexType>
			<xs:sequence>
				<xs:element ref="nombre" />
				<xs:element ref="longitud" />
				<xs:element ref="anchura" />
				<xs:element ref="fecha" />
				<xs:element ref="horaInicio" />
				<xs:element ref="vueltas" />
				<xs:element ref="localidad" />
				<xs:element ref="pais" />
				<xs:element ref="referencias" />
				<xs:element ref="fotos" />
				<xs:element ref="videos" />
				<xs:element ref="coordenada" />
				<xs:element ref="tramos" />
			</xs:sequence>
		</xs:complexType>
	</xs:element>
	<xs:element name="nombre" type="xs:string" />
	<xs:element name="longitud">
		<xs:complexType>
			<xs:simpleContent>
				<xs:extension base="doubleNumberRestriction">
					<xs:attribute name="measure" type="xs:string" use="required" />
				</xs:extension>
			</xs:simpleContent>
		</xs:complexType>
	</xs:element>
	<xs:element name="anchura">
		<xs:complexType>
			<xs:simpleContent>
				<xs:extension base="doubleNumberRestriction">
					<xs:attribute name="measure" type="xs:string" use="required" />
				</xs:extension>	
			</xs:simpleContent>
		</xs:complexType>
	</xs:element>
	<xs:simpleType name="doubleNumberRestriction">
	<xs:restriction base="xs:double">
	  <xs:minInclusive value="0"/>
	</xs:restriction>
  </xs:simpleType>
	<xs:element name="fecha" type="xs:date" />
	<xs:element name="horaInicio" type="xs:time" />
	<xs:element name="vueltas" type="xs:integer" />
	<xs:element name="localidad" type="xs:string" />
	<xs:element name="pais" type="xs:string" />
	<xs:element name="referencias">
		<xs:complexType>
			<xs:sequence>
				<xs:element minOccurs="3" maxOccurs="unbounded" ref="referencia" />
			</xs:sequence>
		</xs:complexType>
	</xs:element>
	<xs:element name="referencia">
		<xs:complexType>
			<xs:simpleContent>
				<xs:extension base="xs:string">
					<xs:attribute name="webSource" type="xs:string" use="required" />
				</xs:extension>
			</xs:simpleContent>
		</xs:complexType>
	</xs:element>
	<xs:element name="fotos">
		<xs:complexType>
			<xs:sequence>
				<xs:element minOccurs="1" maxOccurs="5" ref="foto" />
			</xs:sequence>
		</xs:complexType>
	</xs:element>
	<xs:element name="foto">
		<xs:complexType>
			<xs:simpleContent>
				<xs:extension base="xs:string">
					<xs:attribute name="img" type="xs:string" use="required" />
					<xs:attribute name="alt" type="xs:string" use="required" />
				</xs:extension>
			</xs:simpleContent>
		</xs:complexType>
	</xs:element>
	<xs:element name="videos">
		<xs:complexType>
			<xs:sequence>
				<xs:element minOccurs="0" maxOccurs="3" ref="video" />
			</xs:sequence>
		</xs:complexType>
	</xs:element>
	<xs:element name="video">
		<xs:complexType>
			<xs:simpleContent>
				<xs:extension base="xs:string">
					<xs:attribute name="src" type="xs:string" use="required" />
				</xs:extension>
			</xs:simpleContent>
		</xs:complexType>
	</xs:element>
	<xs:element name="coordenada">
		<xs:complexType>
			<xs:sequence>
				<xs:element ref="cooLongitud" />
				<xs:element ref="cooLatitud" />
				<xs:element ref="cooAltitud" />
			</xs:sequence>
		</xs:complexType>
	</xs:element>
	<xs:element name="cooLongitud">
		<xs:simpleType>
			<xs:restriction base="xs:double">
				<xs:minInclusive value="0"/>
			</xs:restriction>
		</xs:simpleType>
	</xs:element>
	<xs:element name="cooLatitud">
		<xs:simpleType>
			<xs:restriction base="xs:double">
				<xs:minInclusive value="0"/>
			</xs:restriction>
		</xs:simpleType>
	</xs:element>
	<xs:element name="cooAltitud">
		<xs:simpleType>
			<xs:restriction base="xs:double">
				<xs:minInclusive value="0"/>
			</xs:restriction>
		</xs:simpleType>
	</xs:element>
	<xs:element name="tramos">
		<xs:complexType>
			<xs:sequence>
				<xs:element minOccurs="1" maxOccurs="unbounded" ref="tramo" />
			</xs:sequence>
		</xs:complexType>
	</xs:element>
	<xs:element name="tramo">
		<xs:complexType>
			<xs:sequence>
				<xs:element ref="longitud" />
				<xs:element ref="coordenada" />
				<xs:element ref="numeroTramo" />
			</xs:sequence>
			<xs:attribute name="tipo" type="xs:string" use="required" />
		</xs:complexType>
	</xs:element>
	<xs:element name="numeroTramo" type="xs:integer"/>
</xs:schema>